id,name,standard_price,list_price,Cost
__export__.product_template_812802_1f21d7ed,ubuntu - psicanálise e herança colonial (rodrigo lima; derek hook; sheldon george; patricia gherovici; gautam thakur; sophie mendelsohn; fuad rahmat; david pavón-cuéllar; ursula lau; stephen sheehi; lara sheehi. N-1 Edições) [PSY026000],"0,00","95,00",19
__export__.product_template_108442_d75d08a1,Às voltas com Lautréamont (Laymert Garcia dos Santos. N-1 Edições) [LIT000000],"0,00","55,00",11
__export__.product_template_1703_5512ac14,Émile e Sophie ou os solitários (Jean-Jaqcques Rousseau. Editora Hedra) [FIC065000],"0,00","43,18",8.636
__export__.product_template_63740_f2088b4e,Ética bixa (Paco Vidarte; Pablo Cardellino Soto; Maria Selenir Nunes dos Santos. N-1 Edições) [PHI000000],"0,00","75,00",15
__export__.product_template_1644_9c3f4c04,Índice das coisas mais notáveis (Antônio Vieira; Alcir Pécora. Editora Hedra) [REF004000],"0,00","109,00",21.8
__export__.product_template_5702_0f7abe02,2013 (Camila Jourdan. Editora Circuito) [POL039000],"0,00","67,20",13.44
__export__.product_template_806_6bbc0e3c,A Arte de olhar diferente (Braulio Tavares. Editora Hedra) [YAF036000],"0,00","70,06",14.012
__export__.product_template_1856_7ce28a9c,A Busca onírica por Kadath (H. P. Lovecraft. Editora Hedra) [FIC015000],"0,00","56,00",11.2
__export__.product_template_810_7dfd7d47,A Cidade mágica (Edith Nesbitt. Editora Hedra) [YAF019000],"0,00","74,64",14.928
__export__.product_template_819_9a3fb6d3,A Fábrica de robôs (Karel Tchápek. Editora Hedra) [FIC028000],"0,00","65,48",13.096
__export__.product_template_823_9b3c86f1,A História do planeta azul (Andri Snaer Magnason. Editora Hedra) [JUV029010],"0,00","68,00",13.6
__export__.product_template_1740_73dcce09,A Mulher que virou Tatu (Eliane Camargo; Anita Ekman. Editora Hedra) [FIC010000],"0,00","48,00",9.6
__export__.product_template_1859_2d342b7b,A Pele do lobo e outras peças (Artur Azevedo. Editora Hedra) [DRA014000],"0,00","57,48",11.496
__export__.product_template_1782_f5100dbd,A Semente e a torre (Leonardo da Vinci. Editora Hedra) [JUV007000],"0,00","49,00",9.8
__export__.product_template_1864_fd754f75,A conjuração de Catilina (Salústio; Adriano Scatolin. Editora Hedra) [HIS002020],"0,00","53,48",10.696
__export__.product_template_1868_65af5f2d,A constituição traída (Cleonildo Cruz; Liana Cirne. Editora Hedra) [POL022000],"0,00","159,00",31.8
__export__.product_template_2971_e972756a,A fábrica de robôs [Bolso] (Karel Tchápek. Editora Hedra) [FIC028000],"0,00","57,48",11.496
__export__.product_template_1731_d11f08ea,A fábrica de robôs [Bolso] (Karel Tchápek. Editora Hedra) [FIC028000],"0,00","57,48",11.496
__export__.product_template_1418_21d95e8f,A grande marcha (Ewerton Martins Ribeiro. Editora Circuito) [FIC056000],"0,00","40,00",8
__export__.product_template_1822_f8cefa6e,A guerra do reino divino (Jo Oliveira. Editora Hedra) [CGN010000],"0,00","36,00",7.2
__export__.product_template_812490_dd160323,A história de Doralice (Maria Dolores Wanderley. Editora Circuito) [FIC027000],"0,00","68,00",13.6
__export__.product_template_1347_c7b1d981,A imprensa carnavalesca no Brasil (José Ramos Tinhorão. Editora Hedra) [HIS054000],"0,00","48,00",9.6
__export__.product_template_812801_b790b562,A melodia trágica (Rogério Skylab. Acorde) [MUS055000],"0,00","135,00",27
__export__.product_template_1716_07a58edd,A metamorfose (Bilíngue) (Franz Kafka; Celso Cruz. Editora Hedra) [FIC004000],"0,00","71,20",14.24
__export__.product_template_1329_9094b96b,A outra morte de Alberto Caeiro (Afonso Henriques Neto. Editora Circuito) [POE012000],"0,00","40,00",8
__export__.product_template_1870_bf98ad92,A pele do lobo e outras peças (Artur Azevedo; Larissa de Oliveira Neves; Ieda Lebensztayn. Editora Hedra) [DRA014000],"0,00","67,56",13.512
__export__.product_template_1330_2c17f080,A reflexão atuante (Sergio Cohn. Editora Circuito) [POL003000],"0,00","35,00",7
__export__.product_template_811745_374c7007,A revolta nas ruas (Matheus Marestoni; Peter Gelderloos. Editora Circuito) [POL042010],"0,00","85,00",17
__export__.product_template_1621_4b1be8fd,A sociedade de controle (Joyce Souza; Rodolfo Avelino; Sérgio Amadeu da Silveira. Editora Hedra) [LAN004000],"0,00","59,00",11.8
__export__.product_template_122195_47797bad,Acontecimentos na irrealidade imediata (Max Blecher; Fernando Klabin; Fábio Zuker. Ayllon) [FIC080999],"0,00","60,13",12.026
__export__.product_template_1654_426f954a,"Adeus, ponta do meu nariz (Edward Lear. Editora Hedra) [YAF048000]","0,00","43,00",8.6
__export__.product_template_1361_d9483cb1,Almas selvagens (André Gardel. Editora Circuito) [PER000000],"0,00","30,00",6
__export__.product_template_1337_04888de7,Almas selvagens (André Gardel. Editora Circuito) [PER000000],"0,00","30,00",6
__export__.product_template_1338_14986a9e,Amarração (Renato Rezende. Editora Circuito) [FIC056000],"0,00","40,00",8
__export__.product_template_1732_d123a25e,Anarquismo (Murray Bookchin. Editora Hedra) [POL042010],"0,00","66,17",13.234
__export__.product_template_1640_9deee7bf,Aqui tem coisa (Patativa do Assaré. Editora Hedra) [POE012000],"0,00","48,00",9.6
__export__.product_template_1781_81136d11,As frutas (Izqui. Editora Hedra) [JUV050000],"0,00","24,00",4.8
__export__.product_template_1801_5299524c,As minas de Salomão (Rider Haggard. Editora Hedra) [FIC002000],"0,00","41,00",8.2
__export__.product_template_1543_21df78bb,As relações (Izqui. Editora Hedra) [JUV039000],"0,00","24,00",4.8
__export__.product_template_811746_2b522859,As ruínas de junho (Daniel Souza; Jean Tible. Editora Circuito) [POL042010],"0,00","93,00",18.6
__export__.product_template_1348_2e3eb7d8,Auréola (Renato Rezende. Editora Circuito) [FIC056000],"0,00","40,00",8
__export__.product_template_873_9bc5b7dd,Autobiografia de um super-herói (Alexandre Barbosa de Souza. Editora Hedra) [YAF011000],"0,00","43,00",8.6
__export__.product_template_1376_88b99b1b,Azul escuro (Alexandre Barbosa de Souza. Editora Hedra) [POE012000],"0,00","24,00",4.8
__export__.product_template_811748_e8e9cfa3,Ação direta (Voltairine de Cleyre),"0,00","66,00",13.2
__export__.product_template_1520_b5149435,Cadeira de balanço (Vanessa Campos Rocha; Flávio Castellan. Editora Hedra) [POE012000],"0,00","49,00",9.8
__export__.product_template_1360_59d03066,Cadernos de artista (Moisés Alves. Editora Circuito) [POE012000],"0,00","35,00",7
__export__.product_template_1832_6d703f1f,"Canudos, história em versos (Manuel Pedro das Dores Bombinho. Editora Hedra) [POE012000]","0,00","72,00",14.4
__export__.product_template_1860_1ceb83cc,Carta sobre a tolerância (John Locke),"0,00","43,18",8.636
__export__.product_template_1705_212ca657,Cartas a favor da escravidão (José de Alencar; Tâmis Parron; Ieda Lebensztayn. Editora Hedra) [LIT025030],"0,00","69,28",13.856
__export__.product_template_1388_7e42a8f9,Casal Verde (Índigo. Editora Hedra) [JUV002000],"0,00","34,00",6.8
__export__.product_template_1390_3ea4a324,Cento e uma noites - Histórias árabes da Tunísia (Mamede Mustafa Jarouche. Editora Hedra) [FIC009040],"0,00","30,00",6
__export__.product_template_811754_cbb1e646,Cinema (ao vivo) e memória (Wilson Oliveira Filho. Editora Circuito) [ART009000],"0,00","165,00",33
__export__.product_template_1370_c3951abb,Clínica de artista II (Roberto Corrêa dos Santos. Editora Circuito) [POE012000],"0,00","35,00",7
__export__.product_template_1373_03031c71,Coletivos (Renato Rezende; Felipe Scovino. Editora Circuito) [ART044000],"0,00","20,00",4
__export__.product_template_1764_2d7f5b27,Coleção História Das Religiões: 4 Volumes (Vários autores. Editora Hedra) [REL033000],"0,00","216,00",43.2
__export__.product_template_1730_f18d1ec4,Contos e novelas: obras escolhidas (Júlia Lopes de Almeida; Rodrigo Jorge Ribeiro Neves. Editora Hedra) [FIC029000],"0,00","69,49",13.898
__export__.product_template_1377_c569fdc6,Conversas com curadores e críticos de arte (Renato Rezende; Guilherme Bueno. Editora Circuito) [ART044000],"0,00","30,00",6
__export__.product_template_1800_c70ca261,Cordel: Franklin Maxado (Franklin Maxado. Editora Hedra) [POE012000],"0,00","38,80",7.76
__export__.product_template_1821_799cb138,Cordel: Oliveira de Panelas (Oliveira de Panelas. Editora Hedra) [POE012000],"0,00","44,90",8.98
__export__.product_template_1779_c5b99d4e,Cordel: Severino José (Severino José. Editora Hedra) [POE012000],"0,00","45,20",09.04
__export__.product_template_1630_cfc4e8e8,Cordel: Téo Azevedo (Téo Azevedo. Editora Hedra) [POE012000],"0,00","48,00",9.6
__export__.product_template_1655_9d0a2557,Cordel: Zé Melancia (Zé Melancia. Editora Hedra) [POE012000],"0,00","60,91",12.182
__export__.product_template_812651_8ca49eca,Corpo Lab Palavra (Aline Bernardi; Lígia Tourinho. Editora Circuito) [PER003000],"0,00","135,00",27
__export__.product_template_1697_73eaad24,Correspondência (Johann Wolfgang Von Goethe; Friedrich Von Schiller. Editora Hedra) [LCO011000],"0,00","59,60",11.92
__export__.product_template_1379_7a350cda,Cosmocrunch (Maria Dolores Wanderley. Editora Circuito) [FIC056000],"0,00","20,00",4
__export__.product_template_5016_60027a91,Crime (1877–1879) (Luiz Gama; Bruno Rodrigues de Lima. Editora Hedra) [SOC054000],"0,00","118,90",23.78
__export__.product_template_1685_939cf25d,Crédito à morte (Anselm Jappe. Editora Hedra) [PHI019000],"0,00","84,36",16.872
__export__.product_template_1668_bff9d8eb,Cultura pop japonesa (Sonia Bide Luyten. Editora Hedra) [SOC052000],"0,00","48,00",9.6
__export__.product_template_1381_c529c5c3,Cultura popular - uma introdução (Dominic Strinati. Editora Hedra) [SOC022000],"0,00","67,00",13.4
__export__.product_template_1579_e8a10598,Cão (Rafael Mantovani. Editora Hedra) [POE012000],"0,00","8,00",1.6
__export__.product_template_1382_7eebbd94,Cérebro-Ocidente/Cérebro-Brasil (Roberto Corrêa dos Santos. Editora Circuito) [ART044000],"0,00","50,00",10
__export__.product_template_1838_99741ca1,Círculos de coca e fumaça (Danilo Paiva Ramos. Editora Hedra) [SOC002010],"0,00","159,00",31.8
__export__.product_template_1374_051238c1,DJs,"0,00","20,00",4
__export__.product_template_1383_7ae1fb0e,Daniel Acosta (Tadeu Chiarelli; Martin Grossman; Angélica de Moraes; Agnaldo Farias; Carla Zaccagnini. Editora Circuito) [ART044000],"0,00","80,00",16
__export__.product_template_1810_574c0c29,Dançando em Lúnassa (Brian Frield. Editora Hedra) [DRA003000],"0,00","55,76",11.152
__export__.product_template_1492_58f6982e,Dao de Jing,"0,00","48,00",9.6
__export__.product_template_812426_0a9c90a9,Deleuze: as diferenças intensivas e a potência do pensamento (Sandro Kobol Fornazari. N-1 Edições) [PHI000000],"0,00","60,00",12
__export__.product_template_1675_1ea359d9,Descobrindo o Islã no Brasil (Karla Lima. Editora Hedra) [SOC039000],"0,00","82,95",16.59
__export__.product_template_1766_24ee4868,Descort (Dirceu Villa. Editora Hedra) [POE012000],"0,00","24,00",4.8
__export__.product_template_1385_bc976391,Descort (Dirceu Villa. Editora Hedra) [POE012000],"0,00","24,00",4.8
__export__.product_template_1387_77eb3a5b,Dezembro (Ana Tereza Salek. Editora Circuito) [POE012000],"0,00","25,00",5
__export__.product_template_5017_19b5116e,Direito (1870–1875) (Luiz Gama; Bruno Rodrigues de Lima. Editora Hedra) [SOC054000],"0,00","149,90",29.98
__export__.product_template_1739_54a71435,Diários de Adão e Eva (Mark Twain. Editora Hedra) [LCO002000],"0,00","54,62",10.924
__export__.product_template_1416_7ce106f6,Do futuro e da morte do teatro brasileiro (Christina Barros Riego. Editora Hedra) [LIT004100],"0,00","78,00",15.6
__export__.product_template_1394_32823984,Do tudo e do todo (Cláudio Oliveira. Editora Circuito) [POL003000],"0,00","40,00",8
__export__.product_template_1395_a2c80bc8,Doctypes (Alex Hamburger. Editora Circuito) [POE012000],"0,00","30,00",6
__export__.product_template_1672_00b9b708,Dos nervos (Ricardo Lísias. Editora Hedra) [FIC000000],"0,00","32,00",6.4
__export__.product_template_1699_f464484d,Dublinenses (James Joyce. Editora Hedra) [FIC029000],"0,00","87,84",17.568
__export__.product_template_122274_c4c4c9e3,Em busca de meus irmãos na América (Chaim Novodvorsky; Lilian Starobinas; Léa Baran; Roney Cytrynowicz. Ayllon) [BIO037000],"0,00","52,69",10.538
__export__.product_template_1749_810e5d58,Em busca do Japão contemporâneo (John Milton. Editora Hedra) [SOC053000],"0,00","54,05",10.81
__export__.product_template_1400_6f994b24,Em caso de emergência pare o tempo (Gab Marcondes. Editora Circuito) [POE012000],"0,00","40,00",8
__export__.product_template_1745_b36c3940,Ernestine ou o nascimento do amor (Stendhal. Editora Hedra) [FIC004000],"0,00","54,05",10.81
__export__.product_template_1428_b852e97d,Escrever sobre escrever poesia (Eduardo Milán. Editora Circuito) [LIT004100],"0,00","30,00",6
__export__.product_template_1404_e2bec7a8,Escrever sobre escrever poesia (Eduardo Milán. Editora Circuito) [LIT004100],"0,00","30,00",6
__export__.product_template_1405_c8eb694b,Escritos sobre fotografia contemporânea brasileira (Antonio Fatorelli; Leandro Pimentel; Victa de Carvalho. Editora Circuito) [PER000000],"0,00","40,00",8
__export__.product_template_1866_983774dd,Escritório; O Espaço da Produção (Claudio Silveira Amaral. Editora Hedra) [SOC026030],"0,00","54,00",10.8
__export__.product_template_1406_1551cd57,Esperando a hora da Stella (Maria Dolores Wanderley. Editora Circuito) [POE012000],"0,00","30,00",6
__export__.product_template_1836_063482ba,Estado crítico (Régis Bonvicino. Editora Hedra) [POE012000],"0,00","48,00",9.6
__export__.product_template_1409_cd4824bd,Experiência e arte contemporânea (Ana Kiffer; Renato Rezende; Christopher Bident. Editora Circuito) [ART044000],"0,00","40,00",8
__export__.product_template_1410_0d33bb8b,Falar o que seja é inútil – ou sobre desconsiderações (Carlos Alberto Gianotti. Editora Circuito) [FIC056000],"0,00","30,00",6
__export__.product_template_1522_806b71db,Fazendo Rizoma (Beatriz Furtado; Daniel Lins. Editora Hedra) [LCO010000],"0,00","42,00",8.4
__export__.product_template_1412_62f5f1e8,Flor do deserto (Waris Dirie; Cathleen Miller. Editora Hedra) [BIO022000],"0,00","66,00",13.2
__export__.product_template_1436_2f8e7c9e,Flor do deserto (Waris Dirie; Cathleen Miller. Editora Hedra) [BIO022000],"0,00","66,00",13.2
__export__.product_template_113503_ad9bd5ae,Fragmentos de um diário encontrado (Mihail Sebastian; Fernando Klabin; Luis Krausz; Gabriel Neinstein. Ayllon) [FIC048000],"0,00","49,90",9.98
__export__.product_template_812652_1d46e5a4,Frestas (Sheila Cabo Geraldo. Editora Circuito) [ART015110],"0,00","73,00",14.6
__export__.product_template_1661_ca770e5c,Fábula de Polifemo e Galatéia e outros poemas (Góngora. Editora Hedra) [POE020000],"0,00","39,00",7.8
__export__.product_template_1680_d90bbfce,Gangorra (Regina Sawaya. Editora Hedra) [FIC041000],"0,00","81,50",16.3
__export__.product_template_1419_ae365142,Greenpeace mundializacao e política,"0,00","62,00",12.4
__export__.product_template_1729_5e731623,Greve contra a guerra (Ricardo Lísias. Editora Hedra) [JUV039180],"0,00","42,00",8.4
__export__.product_template_1767_2aabba17,Hawthorne e seus musgos (Herman Melville. Editora Hedra) [LIT024050],"0,00","33,00",6.6
__export__.product_template_1708_78243b27,Helio Piñon : Ideias e formas (Helen Pfeiffe; Ana Rosa. Editora Hedra) [LCO010000],"0,00","59,00",11.8
__export__.product_template_811750_fa970a3f,Hiperorganismos (Carlos Augusto Moreira da Nóbrega; Fernanda Morse; Renato Rezende. Editora Circuito) [ART009000],"0,00","220,00",44
__export__.product_template_1871_336e0424,História da Anarquia (Max Nettlau. Editora Hedra) [HIS031000],"0,00","51,60",10.32
__export__.product_template_1723_07c48387,Histórias de igrejas destruídas (Eduardo Brigagão Verderame. Editora Hedra) [HIS054000],"0,00","71,00",14.2
__export__.product_template_1094_e1705add,Histórias escondidas (Odilon Moraes. Editora Hedra) [JUV051000],"0,00","55,28",11.056
__export__.product_template_1778_2c56bbff,Homo Pictor (Christoph Wulf. Editora Hedra) [SOC002010],"0,00","54,00",10.8
__export__.product_template_1788_98175bc0,Imagem contemporânea II (Beatriz Furtado. Editora Hedra) [ART009000],"0,00","65,00",13
__export__.product_template_811752_fdee2686,Imagens insurgentes (Ivair Reinaldim; Luciano Vinhosa. Editora Circuito) [ART009000],"0,00","130,00",26
__export__.product_template_1847_10ffe838,Incidentes da vida de uma escrava (Harriet Ann Jacobs; Tâmis Parron; Araújo da Costa Francisco; Kellie Carter Jackson. Editora Hedra) [BIO026000],"0,00","119,00",23.8
__export__.product_template_1865_b6219ce0,Introdução à fonologia da língua portuguesa (Waldemar Ferreira Netto. Editora Hedra) [LAN011000],"0,00","53,00",10.6
__export__.product_template_117672_93f8264e,Israel e Palestina (Gershon Baskin; Christian Dunker. Ayllon) [POL034000],"0,00","139,00",27.8
__export__.product_template_114038_aee316d5,Jazz rural (Mario Andrade; Enrique Menezes. Editora Hedra) [MUS015000],"0,00","56,91",11.382
__export__.product_template_1437_2e71e83f,Lab Criativo / Creative Lab (Paul Heritage; Batman Zavareze; Renato Rezende. Editora Circuito) [ART044000],"0,00","40,00",8
__export__.product_template_1438_00dc9a17,Lasca de breu (Guilherme Delgado. Editora Circuito) [POE012000],"0,00","30,00",6
__export__.product_template_1439_abe450bd,Leituras furadas (Luis Felipe Fabre. Editora Circuito) [LIT004100],"0,00","30,00",6
__export__.product_template_1440_24b43894,Levantem lentamente o lençol (Bia Albernaz. Editora Circuito) [POE012000],"0,00","30,00",6
__export__.product_template_1524_d5c349c3,Linear G (Gilberto Mendonça Teles. Editora Hedra) [POE012000],"0,00","48,00",9.6
__export__.product_template_1441_0886ae4b,Lira dos sentidos (Carlos Henrique Costa. Editora Circuito) [POE012000],"0,00","30,00",6
__export__.product_template_812810_d72d527e,Lugares do delírio (Tania Rivera. N-1 Edições) [ART000000],"0,00","99,00",19.8
__export__.product_template_1442_06a7efde,Lótus molotov (Leonardo Toledo. Editora Circuito) [POE012000],"0,00","30,00",6
__export__.product_template_1791_c292708d,Marco Cornélio Frontão (Pascal Quignard. Editora Hedra) [LAN015000],"0,00","37,46",7.492
__export__.product_template_1129_db15b15f,Mare Nostrum (Fabio Atui. Editora Hedra) [FIC002000],"0,00","67,00",13.4
__export__.product_template_1809_038ed8e0,Memórias do subsolo (Fiódor Dostoiévski; Lucas Simone. Editora Hedra) [LCO014000],"0,00","64,91",12.982
__export__.product_template_1670_57995178,Mistério na zona sul (Roberto Barbato Junior; Dave Santana. Editora Hedra) [YAF029000],"0,00","56,91",11.382
__export__.product_template_1727_08688fdc,Mistério no morro do deleite (Roberto Barbato Junior; Dave Santana. Editora Hedra) [YAF029000],"0,00","44,00",8.8
__export__.product_template_1688_ca6d191e,Monoteísmos e dualismos: as religiões da salvação (Giovanni Filoramo. Editora Hedra) [REL033000],"0,00","60,00",12
__export__.product_template_1458_dfd7cc09,Mudança (Verónica Gerber Bicecci. Editora Circuito) [LIT004100],"0,00","30,00",6
__export__.product_template_1795_666a44a8,Museu arte hoje (Martin Grossmann; Gilberto Mariotti. Editora Hedra) [ART015110],"0,00","44,00",8.8
__export__.product_template_1460_77390ed4,Música Chama (Pedro Sá Moraes; Eduardo Guerreiro B. Losso. Editora Circuito) [PER000000],"0,00","40,00",8
__export__.product_template_1853_45e01f66,Nas montanhas da loucura (H. P. Lovecraft. Editora Hedra) [FIC015000],"0,00","54,00",10.8
__export__.product_template_1872_79bef0ec,Nascidos na escravidão (Tâmis Parron; Francisco Araújo da Costa; Paul D. Escott; WPA Works Progress Administration. Editora Hedra) [BIO006000],"0,00","114,00",22.8
__export__.product_template_5023_41a2432d,Natali Tubenchlak (Cláudio Oliveira; Tereza Arijón; Natali Tubenchlak. Editora Circuito) [ART037000],"0,00","96,90",19.38
__export__.product_template_1464_c3d85090,Naxos,"0,00","40,00",8
__export__.product_template_1799_ebafb2b0,Neoplatonismo (Cicero Cunha Bezerra; Oscar Federico Bauchwitz. Editora Hedra) [PHI002000],"0,00","86,65",17.33
__export__.product_template_1465_46b9710b,Ninfas e Mariposas (Leonardo Toledo. Editora Circuito) [POE012000],"0,00","30,00",6
__export__.product_template_1466_1608ed67,No contemporâneo: arte e escritura expandidas (Roberto Corrêa dos Santos; Renato Rezende. Editora Circuito) [ART044000],"0,00","60,00",12
__export__.product_template_1472_b9adb186,"Nomadismos - duchamp, o capitão nemo e eu (Alfredo Prior)","0,00","39,00",7.8
__export__.product_template_1483_e4379a74,Nove tiros em Chef Lidu (Paula Bajer Fernandes. Editora Circuito) [FIC056000],"0,00","40,00",8
__export__.product_template_1484_ea6ddc19,Novos barbaros (os ) (Rodrigo Savazoni),"0,00","35,00",7
__export__.product_template_1478_524331e5,Nós somos uma correspondência (Fernanda de Mello Gentil. Editora Circuito) [FIC056000],"0,00","64,00",12.8
__export__.product_template_1479_2b7aedfe,"Nós, o outro, o distante na arte brasileira contemporânea (Marisa Flórido Cesar. Editora Circuito) [ART044000]","0,00","60,00",12
__export__.product_template_1462_9528a679,N’Ágorainda (Naila Rachid. Editora Circuito) [POE012000],"0,00","35,00",7
__export__.product_template_1627_217338f2,O Caso de Charles Dexter Ward (H. P. Lovecraft. Editora Hedra) [FIC015000],"0,00","60,00",12
__export__.product_template_1629_cbe4cbfa,O Fantástico reparador de feridas (Brian Friel. Editora Hedra) [DRA003000],"0,00","45,00",9
__export__.product_template_1617_2a448e49,O Homem da cabeça de papelão (João do Rio. Editora Hedra) [YAF058260],"0,00","48,00",9.6
__export__.product_template_1620_390da2d9,O Horror de Dunwich (H. P. Lovecraft. Editora Hedra) [FIC015000],"0,00","57,00",11.4
__export__.product_template_811749_27f21ed8,"O Indivíduo, a sociedade e o Estado e outros ensaios (Emma Goldman. Editora Hedra) [POL042010]","0,00","86,00",17.2
__export__.product_template_1854_77e18ea7,O Príncipe (Bilíngue) (Nicolau Maquiavel; José Antônio Martins. Editora Hedra) [POL010000],"0,00","149,00",29.8
__export__.product_template_1700_032bcb40,"O Que é bom, o que é ruim (Vladimir Maiakóvski. Editora Hedra) [JUV009000]","0,00","48,00",9.6
__export__.product_template_1820_d049de93,O Sol não espera (Marília Castello Branco. Editora Hedra) [YAF011000],"0,00","54,00",10.8
__export__.product_template_1489_88ca35fa,O coletivo aleatório (Luis Marra. Editora Hedra) [SOC057000],"0,00","48,00",9.6
__export__.product_template_1689_70839559,O contador de histórias (Walter Benjamin; Patrícia Lavelle; Georg Otte; Marcelo Backes; Patrícia Lavelle; Amon Pinho; Francisco Machado. Editora Hedra) [PHI000000],"0,00","99,90",19.98
__export__.product_template_1671_1cc623e2,O diário perdido do Jardim Maia (Luís Marra. Editora Hedra) [SOC045000],"0,00","36,00",7.2
__export__.product_template_1776_db5064c1,O menino da rosa (Tony Monti. Editora Hedra) [JUV039020],"0,00","25,00",5
__export__.product_template_1659_0990fa93,O o: a ficção da literatura em Grande Sertão Veredas (João Adolfo Hansen. Editora Hedra) [LIT004100],"0,00","48,00",9.6
__export__.product_template_1493_5409812d,O olho do lince (Guilherme Zarvos. Editora Circuito) [POE012000],"0,00","40,00",8
__export__.product_template_1528_fd987795,O que eu vi o que nós veremos (Santos Dumont. Editora Hedra) [BIO006000],"0,00","54,00",10.8
__export__.product_template_1597_7fbbf26a,O renascimento do autor (Caio Gagliardi. Editora Hedra) [LIT004100],"0,00","57,48",11.496
__export__.product_template_1553_b722e79f,O ser-se (Júnia Azevedo. Editora Circuito) [FIC056000],"0,00","30,00",6
__export__.product_template_1577_0d8f448f,O ser-se (Júnia Azevedo. Editora Circuito) [FIC056000],"0,00","30,00",6
__export__.product_template_1496_fdc02bf1,O tropo tropicalista (João Camillo Penna. Editora Circuito) [POL003000],"0,00","40,00",8
__export__.product_template_1497_fb3d2866,Onde late um cachorro doido (Moisés Alves. Editora Circuito) [POE012000],"0,00","30,00",6
__export__.product_template_1873_692238e5,Oração aos moços (Rui Barbosa. Editora Hedra) [LAN018000],"0,00","26,00",5.2
__export__.product_template_812439_e8d7cefc,Orun (Paula Scamparini. Editora Circuito) [PHO000000],"0,00","66,00",13.2
__export__.product_template_1787_dc6c1a07,Os Americanos (Nathaniel Hawthorne; Edgar Allan Poe; Herman Melville. Editora Hedra) [LCO002000],"0,00","169,00",33.8
__export__.product_template_1536_c44702c7,Os Franceses (Voltaire; Jean-Jacques Rousseau; Xavier de Maistre. Editora Hedra) [LCO008020],"0,00","199,00",39.8
__export__.product_template_112276_87e23071,Os Sovietes traídos pelos bolcheviques (Rudolf Rocker. Editora Hedra) [HIS032000],"0,00","56,33",11.266
__export__.product_template_1771_64a20ea9,Os cantos do homem-sombra (Patience Epps; Danilo Paiva Ramos; Anita Ekman. Editora Hedra) [FIC010000],"0,00","48,00",9.6
__export__.product_template_1354_26c70d63,Os cães de que desistimos (Chantal Castel. Editora Hedra) [POE012000],"0,00","30,00",6
__export__.product_template_1607_7da8d8df,Os insetos (Izqui. Editora Hedra) [JUV002140],"0,00","24,00",4.8
__export__.product_template_1506_b3069659,Os nomes (Rogério Luz),"0,00","35,00",7
__export__.product_template_1507_e9db7579,Os tigres cravaram as garras no horizonte (Augusto Guimaraens Cavalcanti. Editora Circuito) [POE012000],"0,00","25,00",5
__export__.product_template_1508_c21098a5,Os xeretas e o segredo do medalhão (Claudio Galperin. Editora Hedra) [FIC002000],"0,00","43,00",8.6
__export__.product_template_812497_d982eef7,"Otacílio Batista, uma história do repente brasileiro (Sandino Patriota. Acorde) [MUS050000]","0,00","89,90",17.98
